{
 "schema_version": "1.0.0",
 "generated_at": "2026-10-26T08:15:00Z",
 "publisher": "DLSS5NVIDIA (https://www.dlss5nvidia.com/dlss-checker)",
 "license": {
  "data": "CC-BY-4.0",
  "code": "MIT"
 },
 "disclaimer": "Independent compilation. Not affiliated with, endorsed by, or published by NVIDIA. Facts are attributed to NVIDIA's own pages per entry; anything we could not verify from an official page is recorded as 'unknown'.",
 "fields": {
  "status": "confirmed | planned | unsupported | unknown",
  "localSoftware.fit": "measured | supported | below-minimum",
  "feature keys": "neural (DLSS 5 neural rendering), superResolution, frameGeneration, multiFrameGeneration"
 },
 "gpus": [
  {
   "slug": "rtx-5090",
   "vendor": "nvidia",
   "name": "GeForce RTX 5090",
   "aliases": [
    "NVIDIA GeForce RTX 5090",
    "RTX 5090"
   ],
   "generation": "GeForce RTX 50 Series",
   "status": "confirmed",
   "note": "NVIDIA names all RTX 50 Series GPUs; the checked launch game is NBA 2K27. A compatible GPU alone does not enable every game.",
   "sources": [
    {
     "label": "NVIDIA supported hardware table",
     "url": "https://www.nvidia.com/en-us/geforce/technologies/dlss/",
     "checkedAt": "2026-10-26"
    },
    {
     "label": "NVIDIA launch scope: NBA 2K27",
     "url": "https://www.nvidia.com/en-us/geforce/news/dlss-5-3d-guided-neural-rendering/",
     "checkedAt": "2026-10-26"
    }
   ],
   "lastVerified": "2026-10-26",
   "localSoftware": {
    "fit": "supported",
    "reason": "Inference from our published RTX 20-series-or-newer minimum, not a test of this model. Other OS, memory, driver and engine requirements still apply."
   },
   "workflowTier": "ok",
   "features": {
    "neural": {
     "status": "confirmed",
     "note": "NVIDIA names all RTX 50 Series GPUs; the checked launch game is NBA 2K27. A compatible GPU alone does not enable every game.",
     "sources": [
      {
       "label": "NVIDIA supported hardware table",
       "url": "https://www.nvidia.com/en-us/geforce/technologies/dlss/",
       "checkedAt": "2026-10-26"
      },
      {
       "label": "NVIDIA launch scope: NBA 2K27",
       "url": "https://www.nvidia.com/en-us/geforce/news/dlss-5-3d-guided-neural-rendering/",
       "checkedAt": "2026-10-26"
      }
     ],
     "lastVerified": "2026-10-26"
    },
    "superResolution": {
     "status": "confirmed",
     "note": "Supported hardware family; the game must integrate this feature.",
     "sources": [
      {
       "label": "NVIDIA supported hardware table",
       "url": "https://www.nvidia.com/en-us/geforce/technologies/dlss/",
       "checkedAt": "2026-10-26"
      }
     ],
     "lastVerified": "2026-10-26"
    },
    "frameGeneration": {
     "status": "confirmed",
     "note": "Supported hardware family; game integration is still required.",
     "sources": [
      {
       "label": "NVIDIA supported hardware table",
       "url": "https://www.nvidia.com/en-us/geforce/technologies/dlss/",
       "checkedAt": "2026-10-26"
      }
     ],
     "lastVerified": "2026-10-26"
    },
    "multiFrameGeneration": {
     "status": "confirmed",
     "note": "The official table lists Dynamic Multi Frame Generation for RTX 50. This does not assert every game or mode is available.",
     "sources": [
      {
       "label": "NVIDIA supported hardware table",
       "url": "https://www.nvidia.com/en-us/geforce/technologies/dlss/",
       "checkedAt": "2026-10-26"
      }
     ],
     "lastVerified": "2026-10-26"
    }
   }
  },
  {
   "slug": "rtx-5080",
   "vendor": "nvidia",
   "name": "GeForce RTX 5080",
   "aliases": [
    "NVIDIA GeForce RTX 5080",
    "RTX 5080"
   ],
   "generation": "GeForce RTX 50 Series",
   "status": "confirmed",
   "note": "NVIDIA names all RTX 50 Series GPUs; the checked launch game is NBA 2K27. A compatible GPU alone does not enable every game.",
   "sources": [
    {
     "label": "NVIDIA supported hardware table",
     "url": "https://www.nvidia.com/en-us/geforce/technologies/dlss/",
     "checkedAt": "2026-10-26"
    },
    {
     "label": "NVIDIA launch scope: NBA 2K27",
     "url": "https://www.nvidia.com/en-us/geforce/news/dlss-5-3d-guided-neural-rendering/",
     "checkedAt": "2026-10-26"
    }
   ],
   "lastVerified": "2026-10-26",
   "localSoftware": {
    "fit": "supported",
    "reason": "Inference from our published RTX 20-series-or-newer minimum, not a test of this model. Other OS, memory, driver and engine requirements still apply."
   },
   "workflowTier": "ok",
   "features": {
    "neural": {
     "status": "confirmed",
     "note": "NVIDIA names all RTX 50 Series GPUs; the checked launch game is NBA 2K27. A compatible GPU alone does not enable every game.",
     "sources": [
      {
       "label": "NVIDIA supported hardware table",
       "url": "https://www.nvidia.com/en-us/geforce/technologies/dlss/",
       "checkedAt": "2026-10-26"
      },
      {
       "label": "NVIDIA launch scope: NBA 2K27",
       "url": "https://www.nvidia.com/en-us/geforce/news/dlss-5-3d-guided-neural-rendering/",
       "checkedAt": "2026-10-26"
      }
     ],
     "lastVerified": "2026-10-26"
    },
    "superResolution": {
     "status": "confirmed",
     "note": "Supported hardware family; the game must integrate this feature.",
     "sources": [
      {
       "label": "NVIDIA supported hardware table",
       "url": "https://www.nvidia.com/en-us/geforce/technologies/dlss/",
       "checkedAt": "2026-10-26"
      }
     ],
     "lastVerified": "2026-10-26"
    },
    "frameGeneration": {
     "status": "confirmed",
     "note": "Supported hardware family; game integration is still required.",
     "sources": [
      {
       "label": "NVIDIA supported hardware table",
       "url": "https://www.nvidia.com/en-us/geforce/technologies/dlss/",
       "checkedAt": "2026-10-26"
      }
     ],
     "lastVerified": "2026-10-26"
    },
    "multiFrameGeneration": {
     "status": "confirmed",
     "note": "The official table lists Dynamic Multi Frame Generation for RTX 50. This does not assert every game or mode is available.",
     "sources": [
      {
       "label": "NVIDIA supported hardware table",
       "url": "https://www.nvidia.com/en-us/geforce/technologies/dlss/",
       "checkedAt": "2026-10-26"
      }
     ],
     "lastVerified": "2026-10-26"
    }
   }
  },
  {
   "slug": "rtx-5070-ti",
   "vendor": "nvidia",
   "name": "GeForce RTX 5070 Ti",
   "aliases": [
    "NVIDIA GeForce RTX 5070 Ti",
    "RTX 5070 Ti"
   ],
   "generation": "GeForce RTX 50 Series",
   "status": "confirmed",
   "note": "NVIDIA names all RTX 50 Series GPUs; the checked launch game is NBA 2K27. A compatible GPU alone does not enable every game.",
   "sources": [
    {
     "label": "NVIDIA supported hardware table",
     "url": "https://www.nvidia.com/en-us/geforce/technologies/dlss/",
     "checkedAt": "2026-10-26"
    },
    {
     "label": "NVIDIA launch scope: NBA 2K27",
     "url": "https://www.nvidia.com/en-us/geforce/news/dlss-5-3d-guided-neural-rendering/",
     "checkedAt": "2026-10-26"
    }
   ],
   "lastVerified": "2026-10-26",
   "localSoftware": {
    "fit": "supported",
    "reason": "Inference from our published RTX 20-series-or-newer minimum, not a test of this model. Other OS, memory, driver and engine requirements still apply."
   },
   "workflowTier": "ok",
   "features": {
    "neural": {
     "status": "confirmed",
     "note": "NVIDIA names all RTX 50 Series GPUs; the checked launch game is NBA 2K27. A compatible GPU alone does not enable every game.",
     "sources": [
      {
       "label": "NVIDIA supported hardware table",
       "url": "https://www.nvidia.com/en-us/geforce/technologies/dlss/",
       "checkedAt": "2026-10-26"
      },
      {
       "label": "NVIDIA launch scope: NBA 2K27",
       "url": "https://www.nvidia.com/en-us/geforce/news/dlss-5-3d-guided-neural-rendering/",
       "checkedAt": "2026-10-26"
      }
     ],
     "lastVerified": "2026-10-26"
    },
    "superResolution": {
     "status": "confirmed",
     "note": "Supported hardware family; the game must integrate this feature.",
     "sources": [
      {
       "label": "NVIDIA supported hardware table",
       "url": "https://www.nvidia.com/en-us/geforce/technologies/dlss/",
       "checkedAt": "2026-10-26"
      }
     ],
     "lastVerified": "2026-10-26"
    },
    "frameGeneration": {
     "status": "confirmed",
     "note": "Supported hardware family; game integration is still required.",
     "sources": [
      {
       "label": "NVIDIA supported hardware table",
       "url": "https://www.nvidia.com/en-us/geforce/technologies/dlss/",
       "checkedAt": "2026-10-26"
      }
     ],
     "lastVerified": "2026-10-26"
    },
    "multiFrameGeneration": {
     "status": "confirmed",
     "note": "The official table lists Dynamic Multi Frame Generation for RTX 50. This does not assert every game or mode is available.",
     "sources": [
      {
       "label": "NVIDIA supported hardware table",
       "url": "https://www.nvidia.com/en-us/geforce/technologies/dlss/",
       "checkedAt": "2026-10-26"
      }
     ],
     "lastVerified": "2026-10-26"
    }
   }
  },
  {
   "slug": "rtx-5070",
   "vendor": "nvidia",
   "name": "GeForce RTX 5070",
   "aliases": [
    "NVIDIA GeForce RTX 5070",
    "RTX 5070"
   ],
   "generation": "GeForce RTX 50 Series",
   "status": "confirmed",
   "note": "NVIDIA names all RTX 50 Series GPUs; the checked launch game is NBA 2K27. A compatible GPU alone does not enable every game.",
   "sources": [
    {
     "label": "NVIDIA supported hardware table",
     "url": "https://www.nvidia.com/en-us/geforce/technologies/dlss/",
     "checkedAt": "2026-10-26"
    },
    {
     "label": "NVIDIA launch scope: NBA 2K27",
     "url": "https://www.nvidia.com/en-us/geforce/news/dlss-5-3d-guided-neural-rendering/",
     "checkedAt": "2026-10-26"
    }
   ],
   "lastVerified": "2026-10-26",
   "localSoftware": {
    "fit": "supported",